[
  {
    "id": "exact-truth-identifier",
    "role": "manager",
    "topic": "exact-identifiers",
    "split": "development",
    "query": "celadonquartzaurora",
    "queryClass": "exact",
    "allowedTiers": ["truth"],
    "corpusSnapshot": "fixture:packaged-conformance-v1",
    "expectedPaths": ["docs/truth/findings/F-0101.md"],
    "minimumEvidencePaths": ["docs/truth/findings/F-0101.md"],
    "hardNegativePaths": ["docs/history/retired.md"],
    "expectedCitations": ["docs/truth/findings/F-0101.md"],
    "forbiddenTiers": ["history", "backlog", "campaign", "provisional", "archive", "memory"],
    "tokenBudget": 512,
    "answerable": true
  },
  {
    "id": "conceptual-truth",
    "role": "drafter",
    "topic": "conceptual-retrieval",
    "split": "development",
    "query": "accepted locator numeral seventeen",
    "queryClass": "conceptual",
    "allowedTiers": ["truth"],
    "corpusSnapshot": "fixture:packaged-conformance-v1",
    "expectedPaths": ["docs/truth/findings/F-0101.md"],
    "minimumEvidencePaths": ["docs/truth/findings/F-0101.md"],
    "hardNegativePaths": ["docs/history/retired.md"],
    "expectedCitations": ["docs/truth/findings/F-0101.md"],
    "forbiddenTiers": ["history", "backlog", "campaign", "provisional", "archive", "memory"],
    "tokenBudget": 512,
    "answerable": true
  },
  {
    "id": "history-cannot-cross-wall",
    "role": "manager",
    "topic": "authority-wall",
    "split": "holdout",
    "query": "retiredprocedureomega7f9c2d",
    "queryClass": "current",
    "allowedTiers": ["truth"],
    "corpusSnapshot": "fixture:packaged-conformance-v1",
    "expectedPaths": [],
    "minimumEvidencePaths": [],
    "hardNegativePaths": ["docs/history/holdout-retired.md"],
    "expectedCitations": [],
    "forbiddenTiers": ["history"],
    "tokenBudget": 512,
    "answerable": false
  },
  {
    "id": "accepted-memory-only",
    "role": "manager",
    "topic": "shared-memory",
    "split": "holdout",
    "query": "orientation-shortcut-omega",
    "queryClass": "exact",
    "allowedTiers": ["memory"],
    "corpusSnapshot": "fixture:packaged-conformance-v1",
    "expectedPaths": [".re-discipline/memory/topics/navigation.md"],
    "minimumEvidencePaths": [".re-discipline/memory/topics/navigation.md"],
    "hardNegativePaths": [".re-discipline/memory/proposals/excluded.md"],
    "expectedCitations": [".re-discipline/memory/topics/navigation.md"],
    "forbiddenTiers": ["truth", "history", "backlog", "campaign", "provisional", "archive"],
    "tokenBudget": 512,
    "answerable": true
  },
  {
    "id": "dependency-graph",
    "role": "drafter",
    "topic": "dependency-graph",
    "split": "holdout",
    "query": "obsidianharbor saffronridge",
    "queryClass": "dependency",
    "allowedTiers": ["truth"],
    "corpusSnapshot": "fixture:packaged-conformance-v1",
    "expectedPaths": ["docs/truth/findings/F-0201.md", "docs/truth/findings/F-0204.md"],
    "minimumEvidencePaths": ["docs/truth/findings/F-0201.md", "docs/truth/findings/F-0204.md"],
    "hardNegativePaths": ["docs/backlog/holdout-experiment.md"],
    "expectedCitations": ["docs/truth/findings/F-0201.md", "docs/truth/findings/F-0204.md"],
    "forbiddenTiers": ["history", "backlog", "campaign", "provisional", "archive", "memory"],
    "tokenBudget": 1024,
    "answerable": true
  },
  {
    "id": "profile-orientation",
    "role": "manager",
    "topic": "orientation-profile",
    "split": "development",
    "query": "Knowledge Conformance Project",
    "queryClass": "orientation",
    "allowedTiers": ["profile"],
    "corpusSnapshot": "fixture:packaged-conformance-v1",
    "expectedPaths": [".re-discipline/project-profile.md"],
    "minimumEvidencePaths": [".re-discipline/project-profile.md"],
    "hardNegativePaths": ["docs/history/retired.md"],
    "expectedCitations": [".re-discipline/project-profile.md"],
    "forbiddenTiers": ["history", "backlog", "campaign", "provisional", "archive", "memory"],
    "tokenBudget": 2048,
    "answerable": true
  },
  {
    "id": "campaign-finding-marker",
    "role": "drafter",
    "topic": "campaign-finding",
    "split": "development",
    "query": "active-only-kappa",
    "queryClass": "exact",
    "allowedTiers": ["campaign"],
    "corpusSnapshot": "fixture:packaged-conformance-v1",
    "expectedPaths": ["active/fixture-campaign/findings/F-0001.md"],
    "minimumEvidencePaths": ["active/fixture-campaign/findings/F-0001.md"],
    "hardNegativePaths": ["docs/truth/findings/F-0101.md"],
    "expectedCitations": ["active/fixture-campaign/findings/F-0001.md"],
    "forbiddenTiers": ["truth", "history", "backlog", "provisional", "archive", "memory"],
    "tokenBudget": 1024,
    "answerable": true
  },
  {
    "id": "history-provenance",
    "role": "manager",
    "topic": "history-provenance",
    "split": "development",
    "query": "retired-procedure-zeta",
    "queryClass": "provenance",
    "allowedTiers": ["history"],
    "corpusSnapshot": "fixture:packaged-conformance-v1",
    "expectedPaths": ["docs/history/retired.md"],
    "minimumEvidencePaths": ["docs/history/retired.md"],
    "hardNegativePaths": ["docs/truth/findings/F-0101.md"],
    "expectedCitations": ["docs/history/retired.md"],
    "forbiddenTiers": ["truth", "backlog", "campaign", "provisional", "archive", "memory"],
    "tokenBudget": 4096,
    "answerable": true
  },
  {
    "id": "truth-portability-current",
    "role": "manager",
    "topic": "portability-current",
    "split": "holdout",
    "query": "obsidianharbor violet checksum",
    "queryClass": "current",
    "allowedTiers": ["truth"],
    "corpusSnapshot": "fixture:packaged-conformance-v1",
    "expectedPaths": ["docs/truth/findings/F-0201.md"],
    "minimumEvidencePaths": ["docs/truth/findings/F-0201.md"],
    "hardNegativePaths": ["docs/history/holdout-retired.md"],
    "expectedCitations": ["docs/truth/findings/F-0201.md"],
    "forbiddenTiers": ["history", "backlog", "campaign", "provisional", "archive", "memory"],
    "tokenBudget": 2048,
    "answerable": true
  },
  {
    "id": "drafter-exact-portability",
    "role": "drafter",
    "topic": "portability-exact",
    "split": "holdout",
    "query": "Bramble emits a violet checksum",
    "queryClass": "exact",
    "allowedTiers": ["truth"],
    "corpusSnapshot": "fixture:packaged-conformance-v1",
    "expectedPaths": ["docs/truth/findings/F-0201.md"],
    "minimumEvidencePaths": ["docs/truth/findings/F-0201.md"],
    "hardNegativePaths": ["docs/backlog/holdout-experiment.md"],
    "expectedCitations": ["docs/truth/findings/F-0201.md"],
    "forbiddenTiers": ["history", "backlog", "campaign", "provisional", "archive", "memory"],
    "tokenBudget": 1024,
    "answerable": true
  },
  {
    "id": "backlog-intent",
    "role": "drafter",
    "topic": "backlog-intent",
    "split": "development",
    "query": "future remote model",
    "queryClass": "provenance",
    "allowedTiers": ["backlog"],
    "corpusSnapshot": "fixture:packaged-conformance-v1",
    "expectedPaths": ["docs/backlog/experiment.md"],
    "minimumEvidencePaths": ["docs/backlog/experiment.md"],
    "hardNegativePaths": ["docs/truth/findings/F-0101.md"],
    "expectedCitations": ["docs/backlog/experiment.md"],
    "forbiddenTiers": ["truth", "history", "campaign", "provisional", "archive", "memory"],
    "tokenBudget": 4096,
    "answerable": true
  },
  {
    "id": "navigation-index",
    "role": "drafter",
    "topic": "navigation-index",
    "split": "holdout",
    "query": "Documentation Index",
    "queryClass": "orientation",
    "allowedTiers": ["navigation"],
    "corpusSnapshot": "fixture:packaged-conformance-v1",
    "expectedPaths": ["docs/INDEX.md"],
    "minimumEvidencePaths": ["docs/INDEX.md"],
    "hardNegativePaths": ["docs/backlog/INDEX.md"],
    "expectedCitations": ["docs/INDEX.md"],
    "forbiddenTiers": ["truth", "history", "backlog", "campaign", "provisional", "archive", "memory"],
    "tokenBudget": 1024,
    "answerable": true
  }
]
